{
  "bomFormat": "CycloneDX",
  "specVersion": "1.5",
  "serialNumber": "urn:uuid:llm_guard-1.0.0-mcp-security-enhanced",
  "version": 1,
  "metadata": {
    "timestamp": "2025-09-20T17:11:03.442027Z",
    "tools": [
      {
        "vendor": "PlugPipe",
        "name": "SBOM Generator",
        "version": "1.0.0"
      }
    ],
    "component": {
      "type": "application",
      "bom-ref": "llm_guard@1.0.0",
      "name": "llm_guard",
      "version": "1.0.0",
      "description": "LLM Guard security toolkit integration for comprehensive LLM protection against OWASP Top 10 threats"
    }
  },
  "components": [
    {
      "type": "library",
      "bom-ref": "llm-guard@0.3.16",
      "name": "llm-guard",
      "version": "0.3.16",
      "description": "Protect AI's LLM Guard security toolkit",
      "licenses": [
        {
          "license": {
            "id": "MIT"
          }
        }
      ],
      "purl": "pkg:pypi/llm-guard@0.3.16"
    }
  ],
  "dependencies": [
    {
      "ref": "llm_guard@1.0.0",
      "dependsOn": [
        "llm-guard@0.3.16"
      ]
    }
  ],
  "vulnerabilities": [
    {
      "bom-ref": "CVE-placeholder-llm_guard",
      "id": "CVE-placeholder-llm_guard",
      "description": "Placeholder for llm_guard vulnerability tracking",
      "published": "2025-09-20T17:11:03.442051Z",
      "severity": "low",
      "recommendation": "Monitor llm_guard security advisories"
    }
  ],
  "annotations": [
    {
      "bom-ref": "llm_guard@1.0.0",
      "subjects": [
        "llm_guard@1.0.0"
      ],
      "annotationType": "other",
      "annotation": {
        "name": "plugpipe_principle_compliance",
        "value": "REUSE_EVERYTHING_REINVENT_NOTHING"
      }
    },
    {
      "bom-ref": "llm_guard@1.0.0",
      "subjects": [
        "llm_guard@1.0.0"
      ],
      "annotationType": "other",
      "annotation": {
        "name": "mcp_guardian_integration",
        "value": "owasp_protection_layer"
      }
    },
    {
      "bom-ref": "llm_guard@1.0.0",
      "subjects": [
        "llm_guard@1.0.0"
      ],
      "annotationType": "other",
      "annotation": {
        "name": "security_classification",
        "value": "enterprise_mcp_security_plugin"
      }
    },
    {
      "bom-ref": "llm_guard@1.0.0",
      "subjects": [
        "llm_guard@1.0.0"
      ],
      "annotationType": "other",
      "annotation": {
        "name": "owasp_coverage",
        "value": "LLM01_LLM02_LLM05_LLM07_LLM09"
      }
    }
  ]
}