{
  "bomFormat": "CycloneDX",
  "specVersion": "1.4",
  "serialNumber": "urn:uuid:rag_agent_factory-1.0.0",
  "version": 1,
  "metadata": {
    "timestamp": "2025-09-20T16:56:52.574908Z",
    "tools": [
      {
        "vendor": "PlugPipe",
        "name": "SBOM Generator",
        "version": "1.0.0"
      }
    ],
    "component": {
      "type": "application",
      "bom-ref": "rag_agent_factory@1.0.0",
      "name": "rag_agent_factory",
      "version": "1.0.0",
      "description": "RAG (Retrieval Augmented Generation) Agent Factory - generates specialized knowledge verification agents using the core Agent Factory plugin"
    }
  },
  "components": [],
  "dependencies": [],
  "vulnerabilities": []
}