{
  "bomFormat": "CycloneDX",
  "specVersion": "1.4",
  "serialNumber": "urn:uuid:Registry_Web_Server_Plugin-1.0.0",
  "version": 1,
  "metadata": {
    "timestamp": "2025-09-20T17:25:16.832650Z",
    "tools": [
      {
        "vendor": "PlugPipe",
        "name": "SBOM Generator",
        "version": "1.0.0"
      }
    ],
    "component": {
      "type": "application",
      "bom-ref": "Registry Web Server Plugin@1.0.0",
      "name": "Registry Web Server Plugin",
      "version": "1.0.0",
      "description": "Modern React/Next.js web interface for PlugPipe Universal Integration Hub with enterprise dashboards, plugin discovery, and revolutionary capability showcase"
    }
  },
  "components": [],
  "dependencies": [],
  "vulnerabilities": []
}