{
  "bomFormat": "CycloneDX",
  "specVersion": "1.4",
  "serialNumber": "urn:uuid:mcp_security_compliance_validator-1.0.0",
  "version": 1,
  "metadata": {
    "timestamp": "2025-09-06T09:01:20.784706Z",
    "tools": [
      {
        "vendor": "PlugPipe",
        "name": "SBOM Generator",
        "version": "1.0.0"
      }
    ],
    "component": {
      "type": "application",
      "bom-ref": "mcp_security_compliance_validator@1.0.0",
      "name": "mcp_security_compliance_validator",
      "version": "1.0.0",
      "description": "MCP Security Compliance Validation Plugin - Validates MCP implementations against security standards and compliance frameworks"
    }
  },
  "components": [],
  "dependencies": [],
  "vulnerabilities": []
}