{
  "bomFormat": "CycloneDX",
  "specVersion": "1.5",
  "serialNumber": "urn:uuid:mcp_security_attack_simulator-1.0.0-mcp-security-enhanced",
  "version": 1,
  "metadata": {
    "timestamp": "2025-09-06T09:20:24.962259Z",
    "tools": [
      {
        "vendor": "PlugPipe",
        "name": "SBOM Generator",
        "version": "1.0.0"
      }
    ],
    "component": {
      "type": "application",
      "bom-ref": "mcp_security_attack_simulator@1.0.0",
      "name": "mcp_security_attack_simulator",
      "version": "1.0.0",
      "description": "MCP Security Attack Simulation and Testing Plugin - Simulates security attacks for MCP protocol testing"
    }
  },
  "components": [],
  "dependencies": [
    {
      "ref": "mcp_security_attack_simulator@1.0.0",
      "dependsOn": []
    }
  ],
  "vulnerabilities": [
    {
      "bom-ref": "CVE-placeholder-mcp_security_attack_simulator",
      "id": "CVE-placeholder-mcp_security_attack_simulator",
      "description": "Placeholder for mcp_security_attack_simulator vulnerability tracking",
      "published": "2025-09-06T09:20:24.962281Z",
      "severity": "low",
      "recommendation": "Monitor mcp_security_attack_simulator security advisories"
    }
  ],
  "annotations": [
    {
      "bom-ref": "mcp_security_attack_simulator@1.0.0",
      "subjects": [
        "mcp_security_attack_simulator@1.0.0"
      ],
      "annotationType": "other",
      "annotation": {
        "name": "plugpipe_principle_compliance",
        "value": "REUSE_EVERYTHING_REINVENT_NOTHING"
      }
    },
    {
      "bom-ref": "mcp_security_attack_simulator@1.0.0",
      "subjects": [
        "mcp_security_attack_simulator@1.0.0"
      ],
      "annotationType": "other",
      "annotation": {
        "name": "mcp_guardian_integration",
        "value": "security_layer"
      }
    },
    {
      "bom-ref": "mcp_security_attack_simulator@1.0.0",
      "subjects": [
        "mcp_security_attack_simulator@1.0.0"
      ],
      "annotationType": "other",
      "annotation": {
        "name": "security_classification",
        "value": "enterprise_mcp_security_plugin"
      }
    }
  ]
}