{
  "bomFormat": "CycloneDX",
  "specVersion": "1.4",
  "serialNumber": "urn:uuid:chef-1.0.0",
  "version": 1,
  "metadata": {
    "timestamp": "2025-08-25T11:39:26.489042Z",
    "tools": [
      {
        "vendor": "PlugPipe",
        "name": "SBOM Generator",
        "version": "1.0.0"
      }
    ],
    "component": {
      "type": "application",
      "bom-ref": "chef@1.0.0",
      "name": "chef",
      "version": "1.0.0",
      "description": "Comprehensive Chef configuration management plugin for cookbook management, node bootstrapping, recipe execution, data bags, environments, and both Chef Server/Client and Chef Solo architectures"
    }
  },
  "components": [],
  "dependencies": [],
  "vulnerabilities": []
}