{
  "bomFormat": "CycloneDX",
  "specVersion": "1.5",
  "serialNumber": "urn:uuid:garak_scanner-1.0.0-mcp-security-enhanced",
  "version": 1,
  "metadata": {
    "timestamp": "2025-09-06T09:20:25.031595Z",
    "tools": [
      {
        "vendor": "PlugPipe",
        "name": "SBOM Generator",
        "version": "1.0.0"
      }
    ],
    "component": {
      "type": "application",
      "bom-ref": "garak_scanner@1.0.0",
      "name": "garak_scanner",
      "version": "1.0.0",
      "description": "NVIDIA Garak LLM vulnerability scanner for comprehensive security assessment and red-teaming"
    }
  },
  "components": [
    {
      "type": "library",
      "bom-ref": "garak@0.9.0",
      "name": "garak",
      "version": "0.9.0",
      "description": "NVIDIA's LLM vulnerability scanner framework",
      "licenses": [
        {
          "license": {
            "id": "Apache-2.0"
          }
        }
      ],
      "purl": "pkg:pypi/garak@0.9.0"
    }
  ],
  "dependencies": [
    {
      "ref": "garak_scanner@1.0.0",
      "dependsOn": [
        "garak@0.9.0"
      ]
    }
  ],
  "vulnerabilities": [
    {
      "bom-ref": "CVE-placeholder-garak_scanner",
      "id": "CVE-placeholder-garak_scanner",
      "description": "Placeholder for garak_scanner vulnerability tracking",
      "published": "2025-09-06T09:20:25.031696Z",
      "severity": "low",
      "recommendation": "Monitor garak_scanner security advisories"
    }
  ],
  "annotations": [
    {
      "bom-ref": "garak_scanner@1.0.0",
      "subjects": [
        "garak_scanner@1.0.0"
      ],
      "annotationType": "other",
      "annotation": {
        "name": "plugpipe_principle_compliance",
        "value": "REUSE_EVERYTHING_REINVENT_NOTHING"
      }
    },
    {
      "bom-ref": "garak_scanner@1.0.0",
      "subjects": [
        "garak_scanner@1.0.0"
      ],
      "annotationType": "other",
      "annotation": {
        "name": "mcp_guardian_integration",
        "value": "vulnerability_assessment_layer"
      }
    },
    {
      "bom-ref": "garak_scanner@1.0.0",
      "subjects": [
        "garak_scanner@1.0.0"
      ],
      "annotationType": "other",
      "annotation": {
        "name": "security_classification",
        "value": "enterprise_mcp_red_team_plugin"
      }
    },
    {
      "bom-ref": "garak_scanner@1.0.0",
      "subjects": [
        "garak_scanner@1.0.0"
      ],
      "annotationType": "other",
      "annotation": {
        "name": "owasp_coverage",
        "value": "LLM01_LLM02_LLM03_LLM04_LLM06_LLM08_LLM09_LLM10"
      }
    }
  ]
}